[
  {
    "schema_kind": "odd_world_model.abg_admission_witness",
    "schema_version": "v1",
    "witness_ref": "admission-witness://odd_world_model/sandbox/trade_source_model-proposal-v1",
    "admission_kind": "proposal_evidence",
    "status": "admitted",
    "subjects": [
      {
        "ref": "source-observation://odd_world_model/sandbox/trade_source_model/v1",
        "digest": "sha256:9beb02f0eb66137b7cb55b8b0c46c316e62027fd1bb55c771c23e78493fb4234"
      },
      {
        "ref": "semantic-proposal://odd_world_model/sandbox/trade_source_model/v1",
        "digest": "sha256:a3729796b2985dd3f374896758c0ab603e787dac758da1c7f1454267333850b5"
      }
    ],
    "target_handle": "odd_world_model.publish_domain_model",
    "selected_graph_function_ref": "graph-function://odd_world_model/publish-domain-model/v1",
    "graph_call_refs": [
      "graph-call:execution_basis:{\"moduleName\":\"gtl://module/odd_world_model/context-memory/v1\",\"startIntent\":{\"scope\":{\"kind\":\"workspace\",\"workspaceRoot\":\"/workspace/odd_world_model/rc3-probe\",\"moduleName\":\"gtl://module/odd_world_model/context-memory/v1\"},\"target\":{\"kind\":\"graph_function\",\"handle\":\"odd_world_model.publish_domain_model\"},\"until\":\"converged\",\"inputBindings\":[{\"assetRef\":\"source-observation://odd_world_model/sandbox/trade_source_model/v1\",\"assetType\":\"sandbox_exact_carrier\",\"uri\":\"evidence://odd_world_model/exact/v1?ref=source-observation%3A%2F%2Fodd_world_model%2Fsandbox%2Ftrade_source_model%2Fv1&digest=sha256%3A9beb02f0eb66137b7cb55b8b0c46c316e62027fd1bb55c771c23e78493fb4234\"},{\"assetRef\":\"semantic-proposal://odd_world_model/sandbox/trade_source_model/v1\",\"assetType\":\"sandbox_exact_carrier\",\"uri\":\"evidence://odd_world_model/exact/v1?ref=semantic-proposal%3A%2F%2Fodd_world_model%2Fsandbox%2Ftrade_source_model%2Fv1&digest=sha256%3Aa3729796b2985dd3f374896758c0ab603e787dac758da1c7f1454267333850b5\"}]},\"runtimeIdentity\":{\"workerId\":\"worker://odd_world_model/rc3-probe/v1\",\"backendId\":\"backend://abiogenesis/typescript/v4.6.0-rc.3\",\"buildId\":\"build://odd_world_model/typescript/0.1.0-proving.1\",\"resolvedRuntimeRef\":\"runtime://abiogenesis/4.6.0-rc.3\"},\"resolvedPolicy\":{\"resolvedPolicyBundleRef\":\"policy-bundle://odd_world_model/rc3-probe/v1\",\"defaultRegime\":\"F_D\",\"dispatchRef\":\"dispatch://odd_world_model/rc3-probe/v1\",\"approvalSubjectRef\":null},\"runId\":\"run://odd_world_model/odd_world_model.publish_domain_model/rc3-probe/trade_source_model-proposal-v1\",\"workKey\":\"work://odd_world_model/odd_world_model.publish_domain_model/rc3-probe/trade_source_model-proposal-v1\",\"frameId\":null,\"frameLineageId\":null}"
    ],
    "evidence_refs": [
      "evidence://odd_world_model/exact/v1?ref=source-observation%3A%2F%2Fodd_world_model%2Fsandbox%2Ftrade_source_model%2Fv1&digest=sha256%3A9beb02f0eb66137b7cb55b8b0c46c316e62027fd1bb55c771c23e78493fb4234",
      "evidence://odd_world_model/exact/v1?ref=semantic-proposal%3A%2F%2Fodd_world_model%2Fsandbox%2Ftrade_source_model%2Fv1&digest=sha256%3Aa3729796b2985dd3f374896758c0ab603e787dac758da1c7f1454267333850b5"
    ],
    "evidence_event_refs": [
      "runtime-event:2026-07-12T14:28:27.923Z:21:59444c30-b9cf-4d74-b617-deb34039253c",
      "runtime-event:2026-07-12T14:28:27.933Z:52:4017bba0-6c27-46f1-826f-e9d1a30902a1",
      "runtime-event:2026-07-12T14:28:27.933Z:55:78c6f0a7-221e-4a1d-a853-ce0ace2f5bf7",
      "runtime-event:2026-07-12T14:28:27.951Z:99:fae52568-cfd8-4cf1-9e2d-d7e3881e7b2f",
      "runtime-event:2026-07-12T14:28:27.961Z:126:b1ed40a0-a651-428d-9b64-33648eea0a3c",
      "runtime-event:2026-07-12T14:28:27.974Z:153:d800d3e1-d896-4212-9954-b978a363ab12"
    ],
    "vector_closed_event_refs": [
      "runtime-event:2026-07-12T14:28:27.926Z:33:0579308a-e60d-40ba-b412-27f4ff8f3ca8",
      "runtime-event:2026-07-12T14:28:27.946Z:85:d9036d74-a499-4f34-be36-9e6df4269113",
      "runtime-event:2026-07-12T14:28:27.956Z:111:7f93e07a-a133-464a-97b7-e8103a2bf96c",
      "runtime-event:2026-07-12T14:28:27.966Z:138:4baaefd8-532f-426f-b179-65c0d726945a",
      "runtime-event:2026-07-12T14:28:27.980Z:165:f3dbc873-5582-4a37-a242-6941b59398d7"
    ],
    "terminal_event_ref": "runtime-event:2026-07-12T14:28:27.982Z:167:83b89677-3d8f-47b2-ba42-6e60ffd344bd",
    "runtime_event_refs": [
      "runtime-event:2026-07-12T14:28:27.918Z:8:2426d079-1d57-4619-be08-237349c43842",
      "runtime-event:2026-07-12T14:28:27.918Z:9:cbb66c19-103d-40b4-bfb5-a17d846e7d7f",
      "runtime-event:2026-07-12T14:28:27.927Z:36:319620f1-269e-4b54-9420-1aa16899d146",
      "runtime-event:2026-07-12T14:28:27.948Z:87:c0d10ddc-ba43-4a2a-8e51-55787cfff714",
      "runtime-event:2026-07-12T14:28:27.958Z:114:e9f08d7d-27cb-4beb-ad50-d371df831219",
      "runtime-event:2026-07-12T14:28:27.969Z:141:3a689557-b441-4e42-b8be-cb22a7248348",
      "runtime-event:2026-07-12T14:28:27.923Z:21:59444c30-b9cf-4d74-b617-deb34039253c",
      "runtime-event:2026-07-12T14:28:27.933Z:52:4017bba0-6c27-46f1-826f-e9d1a30902a1",
      "runtime-event:2026-07-12T14:28:27.933Z:55:78c6f0a7-221e-4a1d-a853-ce0ace2f5bf7",
      "runtime-event:2026-07-12T14:28:27.951Z:99:fae52568-cfd8-4cf1-9e2d-d7e3881e7b2f",
      "runtime-event:2026-07-12T14:28:27.961Z:126:b1ed40a0-a651-428d-9b64-33648eea0a3c",
      "runtime-event:2026-07-12T14:28:27.974Z:153:d800d3e1-d896-4212-9954-b978a363ab12",
      "runtime-event:2026-07-12T14:28:27.926Z:33:0579308a-e60d-40ba-b412-27f4ff8f3ca8",
      "runtime-event:2026-07-12T14:28:27.946Z:85:d9036d74-a499-4f34-be36-9e6df4269113",
      "runtime-event:2026-07-12T14:28:27.956Z:111:7f93e07a-a133-464a-97b7-e8103a2bf96c",
      "runtime-event:2026-07-12T14:28:27.966Z:138:4baaefd8-532f-426f-b179-65c0d726945a",
      "runtime-event:2026-07-12T14:28:27.980Z:165:f3dbc873-5582-4a37-a242-6941b59398d7",
      "runtime-event:2026-07-12T14:28:27.982Z:167:83b89677-3d8f-47b2-ba42-6e60ffd344bd"
    ],
    "admitted_at": "2026-07-12T14:28:27.982Z",
    "witness_digest": "sha256:ba89fe680b254654743c772e4ca9a8f30c3e5d5d5fefa9070cfafb5253e04d89"
  },
  {
    "schema_kind": "odd_world_model.abg_admission_witness",
    "schema_version": "v1",
    "witness_ref": "admission-witness://odd_world_model/sandbox/trade_source_model-acceptance-v1",
    "admission_kind": "acceptance_evidence",
    "status": "admitted",
    "subjects": [
      {
        "ref": "deterministic-check://odd_world_model/sandbox/trade_source_model/v1",
        "digest": "sha256:bc5d9e30d12ceea1101941da1cadf8af6a9b9f6533acc4ebe6546b738134b18e"
      },
      {
        "ref": "wm-acceptance://odd_world_model/sandbox/trade_source_model/v1",
        "digest": "sha256:0933678bcdb12faac4e301d32dd2536e4f73586eadd3953be221d3435374871c"
      }
    ],
    "target_handle": "odd_world_model.publish_domain_model",
    "selected_graph_function_ref": "graph-function://odd_world_model/publish-domain-model/v1",
    "graph_call_refs": [
      "graph-call:execution_basis:{\"moduleName\":\"gtl://module/odd_world_model/context-memory/v1\",\"startIntent\":{\"scope\":{\"kind\":\"workspace\",\"workspaceRoot\":\"/workspace/odd_world_model/rc3-probe\",\"moduleName\":\"gtl://module/odd_world_model/context-memory/v1\"},\"target\":{\"kind\":\"graph_function\",\"handle\":\"odd_world_model.publish_domain_model\"},\"until\":\"converged\",\"inputBindings\":[{\"assetRef\":\"deterministic-check://odd_world_model/sandbox/trade_source_model/v1\",\"assetType\":\"sandbox_exact_carrier\",\"uri\":\"evidence://odd_world_model/exact/v1?ref=deterministic-check%3A%2F%2Fodd_world_model%2Fsandbox%2Ftrade_source_model%2Fv1&digest=sha256%3Abc5d9e30d12ceea1101941da1cadf8af6a9b9f6533acc4ebe6546b738134b18e\"},{\"assetRef\":\"wm-acceptance://odd_world_model/sandbox/trade_source_model/v1\",\"assetType\":\"sandbox_exact_carrier\",\"uri\":\"evidence://odd_world_model/exact/v1?ref=wm-acceptance%3A%2F%2Fodd_world_model%2Fsandbox%2Ftrade_source_model%2Fv1&digest=sha256%3A0933678bcdb12faac4e301d32dd2536e4f73586eadd3953be221d3435374871c\"}]},\"runtimeIdentity\":{\"workerId\":\"worker://odd_world_model/rc3-probe/v1\",\"backendId\":\"backend://abiogenesis/typescript/v4.6.0-rc.3\",\"buildId\":\"build://odd_world_model/typescript/0.1.0-proving.1\",\"resolvedRuntimeRef\":\"runtime://abiogenesis/4.6.0-rc.3\"},\"resolvedPolicy\":{\"resolvedPolicyBundleRef\":\"policy-bundle://odd_world_model/rc3-probe/v1\",\"defaultRegime\":\"F_D\",\"dispatchRef\":\"dispatch://odd_world_model/rc3-probe/v1\",\"approvalSubjectRef\":null},\"runId\":\"run://odd_world_model/odd_world_model.publish_domain_model/rc3-probe/trade_source_model-acceptance-v1\",\"workKey\":\"work://odd_world_model/odd_world_model.publish_domain_model/rc3-probe/trade_source_model-acceptance-v1\",\"frameId\":null,\"frameLineageId\":null}"
    ],
    "evidence_refs": [
      "evidence://odd_world_model/exact/v1?ref=deterministic-check%3A%2F%2Fodd_world_model%2Fsandbox%2Ftrade_source_model%2Fv1&digest=sha256%3Abc5d9e30d12ceea1101941da1cadf8af6a9b9f6533acc4ebe6546b738134b18e",
      "evidence://odd_world_model/exact/v1?ref=wm-acceptance%3A%2F%2Fodd_world_model%2Fsandbox%2Ftrade_source_model%2Fv1&digest=sha256%3A0933678bcdb12faac4e301d32dd2536e4f73586eadd3953be221d3435374871c"
    ],
    "evidence_event_refs": [
      "runtime-event:2026-07-12T14:28:27.990Z:189:4fa4a039-dcac-47bd-a12c-a9e0f94241e5",
      "runtime-event:2026-07-12T14:28:27.994Z:220:36bedb72-a043-4895-b668-41969f0ce8c0",
      "runtime-event:2026-07-12T14:28:27.994Z:223:7facb336-8816-4819-a8ff-953649cf56e8",
      "runtime-event:2026-07-12T14:28:28.007Z:267:961dc48c-c34c-468e-b5f6-1092d9f0777c",
      "runtime-event:2026-07-12T14:28:28.015Z:294:61868011-65f9-4516-833c-1333d52f8b58",
      "runtime-event:2026-07-12T14:28:28.027Z:321:7afd79b1-a1ee-45d6-994a-a850fb322d9d"
    ],
    "vector_closed_event_refs": [
      "runtime-event:2026-07-12T14:28:27.991Z:201:f840ab21-61e8-4fc5-a731-948d16cf7b6b",
      "runtime-event:2026-07-12T14:28:28.003Z:253:6afa1df2-2a12-4588-a638-8d4c553e3b83",